[
  {
    "id": "CLI-0001",
    "ficticio": true,
    "origem": "demo",
    "criadoEm": "2025-06-01T12:00:00.000Z",
    "atualizadoEm": "2025-06-01T12:00:00.000Z",
    "criadoPor": "humano",
    "razaoSocial": "Hospital Demonstração Alfa (FICTÍCIO)",
    "nomeFantasia": null,
    "cnpj": null,
    "segmento": "saude",
    "status": "ativo",
    "cidadeUf": "Cidade Exemplo/SP",
    "responsavelId": "AGT-0005",
    "estrategico": true,
    "ultimaCompraEm": null,
    "obs": "Registro fictício para demonstração."
  },
  {
    "id": "CLI-0002",
    "ficticio": true,
    "origem": "demo",
    "criadoEm": "2025-08-01T12:00:00.000Z",
    "atualizadoEm": "2025-08-01T12:00:00.000Z",
    "criadoPor": "humano",
    "razaoSocial": "Lavanderia Industrial Demo Beta (FICTÍCIA)",
    "nomeFantasia": null,
    "cnpj": null,
    "segmento": "lavanderia",
    "status": "ativo",
    "cidadeUf": "Cidade Exemplo/SP",
    "responsavelId": "AGT-0006",
    "estrategico": false,
    "ultimaCompraEm": null,
    "obs": null
  },
  {
    "id": "CLI-0003",
    "ficticio": true,
    "origem": "demo",
    "criadoEm": "2025-09-01T12:00:00.000Z",
    "atualizadoEm": "2025-09-01T12:00:00.000Z",
    "criadoPor": "humano",
    "razaoSocial": "Indústria Demo Gama Gases (FICTÍCIA)",
    "nomeFantasia": null,
    "cnpj": null,
    "segmento": "industria",
    "status": "ativo",
    "cidadeUf": "Cidade Exemplo/SP",
    "responsavelId": "AGT-0005",
    "estrategico": false,
    "ultimaCompraEm": null,
    "obs": null
  },
  {
    "id": "CLI-0004",
    "ficticio": true,
    "origem": "demo",
    "criadoEm": "2026-10-10T12:00:00.000Z",
    "atualizadoEm": "2026-10-10T12:00:00.000Z",
    "criadoPor": "humano",
    "razaoSocial": "Facilities Demo Delta (FICTÍCIA)",
    "nomeFantasia": null,
    "cnpj": null,
    "segmento": "facilities",
    "status": "prospect",
    "cidadeUf": "Cidade Exemplo/SP",
    "responsavelId": "AGT-0006",
    "estrategico": false,
    "ultimaCompraEm": null,
    "obs": null
  },
  {
    "id": "CLI-0005",
    "ficticio": true,
    "origem": "demo",
    "criadoEm": "2025-03-01T12:00:00.000Z",
    "atualizadoEm": "2025-03-01T12:00:00.000Z",
    "criadoPor": "humano",
    "razaoSocial": "Construtora Demo Épsilon (FICTÍCIA)",
    "nomeFantasia": null,
    "cnpj": null,
    "segmento": "construcao",
    "status": "inativo",
    "cidadeUf": "Cidade Exemplo/SP",
    "responsavelId": "AGT-0006",
    "estrategico": false,
    "ultimaCompraEm": "2025-11-01",
    "obs": null
  }
]
